{
  "schema_version": "1",
  "task_id": "P2/E3/T4",
  "status": "PARTIAL",
  "what_changed": [
    { "kind": "file", "ref": "src/lexer/core.py" },
    { "kind": "interface", "ref": "Lexer.tokenize(str) -> list[Token]" },
    { "kind": "artifact", "ref": "P2/E3/T4/handoff.json" }
  ],
  "resulting_state": "lexer mostly done; one edge case open",
  "downstream_needs": ["P2/E3/T4/tokens.json"],
  "not_done": ["unicode escape edge case"],
  "citations": [
    { "file": "src/lexer/core.py", "line": 12 },
    { "file": "docs/lexer.md" }
  ],
  "checks": [
    { "check": "pytest tests/lexer", "exit_code": 1 },
    { "check": "ruff check src/lexer", "exit_code": 0 }
  ],
  "occupancy": { "compacted": true, "subagent_splits": 2, "peak_context_tokens": 64000 }
}
